STN_ID,SITE_CODE,WLM_ID,MSMT_DATE,WLM_RPE,WLM_GSE,RDNG_WS,RDNG_RP,WSE,RPE_WSE,GSE_WSE,WLM_QA_DESC,WLM_DESC,WLM_ACC_DESC,WLM_ORG_ID,WLM_ORG_NAME,MSMT_CMT,COOP_AGENCY_ORG_ID,COOP_ORG_NAME
15484,369435N1208191W001,1265378,1963-10-15T00:00:00Z,167.7,167.7,NA,NA,NA,NA,NA,Well has been destroyed,NA,NA,1,Department of Water Resources,NA,1,Department of Water Resources
15484,369435N1208191W001,1265377,1963-02-25T00:00:00Z,167.7,167.7,NA,NA,NA,NA,NA,Well has been destroyed,NA,NA,1,Department of Water Resources,NA,1,Department of Water Resources
15484,369435N1208191W001,1265376,1962-10-08T00:00:00Z,167.7,167.7,NA,NA,NA,NA,NA,Unable to locate well,NA,NA,1,Department of Water Resources,NA,1,Department of Water Resources
15484,369435N1208191W001,1265375,1962-03-27T00:00:00Z,167.7,167.7,0,18.2,149.5,18.2,18.2,NA,Unknown,Water level accuracy is unknown,1,Department of Water Resources,NA,1,Department of Water Resources
15484,369435N1208191W001,1265374,1959-03-17T00:00:00Z,167.7,167.7,NA,NA,NA,NA,NA,Unable to locate well,NA,NA,1,Department of Water Resources,NA,1,Department of Water Resources
