STN_ID,SITE_CODE,WLM_ID,MSMT_DATE,WLM_RPE,WLM_GSE,RDNG_WS,RDNG_RP,WSE,RPE_WSE,GSE_WSE,WLM_QA_DESC,WLM_DESC,WLM_ACC_DESC,WLM_ORG_ID,WLM_ORG_NAME,MSMT_CMT,COOP_AGENCY_ORG_ID,COOP_ORG_NAME
18856,356789N1195275W001,872100,1962-02-07T00:00:00Z,228.5,227.5,0,113.4,115.1,113.4,112.4,NA,Unknown,Water level accuracy is unknown,1,Department of Water Resources,NA,1,Department of Water Resources
18856,356789N1195275W001,872099,1961-03-09T00:00:00Z,228.5,227.5,NA,NA,NA,NA,NA,Pumping,NA,NA,1,Department of Water Resources,NA,1,Department of Water Resources
18856,356789N1195275W001,872098,1960-10-11T00:00:00Z,228.5,227.5,NA,NA,NA,NA,NA,Tape hung up,NA,NA,1,Department of Water Resources,NA,1,Department of Water Resources
18856,356789N1195275W001,872097,1959-10-13T00:00:00Z,228.5,227.5,0,168.4,60.1,168.4,167.4,NA,Unknown,Water level accuracy is unknown,1,Department of Water Resources,NA,5167,United States Geological Survey
18856,356789N1195275W001,872096,1958-10-29T00:00:00Z,228.5,227.5,NA,NA,NA,NA,NA,Well has been destroyed,NA,NA,1,Department of Water Resources,NA,5167,United States Geological Survey
