STN_ID,SITE_CODE,WLM_ID,MSMT_DATE,WLM_RPE,WLM_GSE,RDNG_WS,RDNG_RP,WSE,RPE_WSE,GSE_WSE,WLM_QA_DESC,WLM_DESC,WLM_ACC_DESC,WLM_ORG_ID,WLM_ORG_NAME,MSMT_CMT,COOP_AGENCY_ORG_ID,COOP_ORG_NAME
19261,362003N1201024W001,938384,1973-02-21T00:00:00Z,371.92,371.92,NA,NA,NA,NA,NA,Well has been destroyed,NA,NA,1,Department of Water Resources,NA,1,Department of Water Resources
19261,362003N1201024W001,938383,1972-01-04T00:00:00Z,371.92,371.92,NA,NA,NA,NA,NA,Can't get tape in casing,NA,NA,1,Department of Water Resources,NA,1,Department of Water Resources
19261,362003N1201024W001,938382,1970-12-14T00:00:00Z,371.92,371.92,0,492,-120.08,492,492,NA,Unknown,Water level accuracy is unknown,1,Department of Water Resources,NA,1,Department of Water Resources
19261,362003N1201024W001,938381,1969-12-09T00:00:00Z,371.92,371.92,0,487,-115.08,487,487,NA,Unknown,Water level accuracy is unknown,1,Department of Water Resources,NA,1,Department of Water Resources
19261,362003N1201024W001,938380,1968-12-18T00:00:00Z,371.92,371.92,0,492.3,-120.38,492.3,492.3,NA,Unknown,Water level accuracy is unknown,1,Department of Water Resources,NA,1,Department of Water Resources
