STN_ID,SITE_CODE,WLM_ID,MSMT_DATE,WLM_RPE,WLM_GSE,RDNG_WS,RDNG_RP,WSE,RPE_WSE,GSE_WSE,WLM_QA_DESC,WLM_DESC,WLM_ACC_DESC,WLM_ORG_ID,WLM_ORG_NAME,MSMT_CMT,COOP_AGENCY_ORG_ID,COOP_ORG_NAME
22574,359056N1200641W001,819911,1960-10-11T00:00:00Z,588.78,583.78,NA,NA,NA,NA,NA,Tape hung up,NA,NA,1,Department of Water Resources,NA,1,Department of Water Resources
22574,359056N1200641W001,819910,1959-10-14T00:00:00Z,588.78,583.78,0,161.5,427.28,161.5,156.5,NA,Unknown,Water level accuracy is unknown,1,Department of Water Resources,NA,5167,United States Geological Survey
22574,359056N1200641W001,819909,1959-03-31T00:00:00Z,588.78,583.78,0,158,430.78,158,153,NA,Unknown,Water level accuracy is unknown,1,Department of Water Resources,NA,5167,United States Geological Survey
22574,359056N1200641W001,819908,1958-10-21T00:00:00Z,588.78,583.78,NA,NA,NA,NA,NA,Can't get tape in casing,NA,NA,1,Department of Water Resources,NA,5167,United States Geological Survey
22574,359056N1200641W001,819907,1958-04-15T00:00:00Z,588.78,583.78,0,156.5,432.28,156.5,151.5,NA,Unknown,Water level accuracy is unknown,1,Department of Water Resources,NA,5167,United States Geological Survey
