STN_ID,SITE_CODE,WLM_ID,MSMT_DATE,WLM_RPE,WLM_GSE,RDNG_WS,RDNG_RP,WSE,RPE_WSE,GSE_WSE,WLM_QA_DESC,WLM_DESC,WLM_ACC_DESC,WLM_ORG_ID,WLM_ORG_NAME,MSMT_CMT,COOP_AGENCY_ORG_ID,COOP_ORG_NAME
23939,354858N1191092W001,731016,1974-01-31T00:00:00Z,508.96,507.66,NA,NA,NA,NA,NA,Well has been destroyed,NA,NA,1,Department of Water Resources,NA,624,Bureau of Reclamation
23939,354858N1191092W001,731015,1972-09-28T00:00:00Z,508.96,507.66,0,452.5,56.46,452.5,451.2,NA,Unknown,Water level accuracy is unknown,1,Department of Water Resources,NA,624,Bureau of Reclamation
23939,354858N1191092W001,731014,1972-01-27T00:00:00Z,508.96,507.66,NA,NA,NA,NA,NA,Measurement Discontinued,NA,NA,1,Department of Water Resources,NA,624,Bureau of Reclamation
23939,354858N1191092W001,731013,1971-09-24T00:00:00Z,508.96,507.66,NA,NA,NA,NA,NA,Can't get tape in casing,NA,NA,1,Department of Water Resources,NA,624,Bureau of Reclamation
23939,354858N1191092W001,731012,1969-09-24T00:00:00Z,508.96,507.66,0,451.3,57.66,451.3,450,NA,Unknown,Water level accuracy is unknown,1,Department of Water Resources,NA,624,Bureau of Reclamation
23939,354858N1191092W001,731011,1969-09-23T00:00:00Z,508.96,507.66,0,452.6,56.36,452.6,451.3,NA,Unknown,Water level accuracy is unknown,1,Department of Water Resources,NA,1,Department of Water Resources
