STN_ID,SITE_CODE,WLM_ID,MSMT_DATE,WLM_RPE,WLM_GSE,RDNG_WS,RDNG_RP,WSE,RPE_WSE,GSE_WSE,WLM_QA_DESC,WLM_DESC,WLM_ACC_DESC,WLM_ORG_ID,WLM_ORG_NAME,MSMT_CMT,COOP_AGENCY_ORG_ID,COOP_ORG_NAME
28382,374405N1210696W001,1414425,1973-04-18T00:00:00Z,75.52,75.42,NA,NA,NA,NA,NA,Well has been destroyed,NA,NA,1,Department of Water Resources,NA,1,Department of Water Resources
28382,374405N1210696W001,1414424,1972-10-13T00:00:00Z,75.52,75.42,NA,NA,NA,NA,NA,Can't get tape in casing,NA,NA,1,Department of Water Resources,NA,1,Department of Water Resources
28382,374405N1210696W001,1414423,1972-03-16T00:00:00Z,75.52,75.42,NA,NA,NA,NA,NA,Can't get tape in casing,NA,NA,1,Department of Water Resources,NA,1,Department of Water Resources
28382,374405N1210696W001,1414422,1971-10-15T00:00:00Z,75.52,75.42,NA,NA,NA,NA,NA,Tape hung up,NA,NA,1,Department of Water Resources,NA,1,Department of Water Resources
28382,374405N1210696W001,1414421,1971-05-20T00:00:00Z,75.52,75.42,0,24.9,50.62,24.9,24.8,NA,Unknown,Water level accuracy is unknown,1,Department of Water Resources,NA,1,Department of Water Resources
