STN_ID,SITE_CODE,WLM_ID,MSMT_DATE,WLM_RPE,WLM_GSE,RDNG_WS,RDNG_RP,WSE,RPE_WSE,GSE_WSE,WLM_QA_DESC,WLM_DESC,WLM_ACC_DESC,WLM_ORG_ID,WLM_ORG_NAME,MSMT_CMT,COOP_AGENCY_ORG_ID,COOP_ORG_NAME
32742,365897N1205221W001,985882,1965-12-18T00:00:00Z,441.76,441.76,NA,NA,NA,NA,NA,Can't get tape in casing,NA,NA,1,Department of Water Resources,NA,1,Department of Water Resources
32742,365897N1205221W001,985881,1964-12-16T00:00:00Z,441.76,441.76,NA,NA,NA,NA,NA,Can't get tape in casing,NA,NA,1,Department of Water Resources,NA,1,Department of Water Resources
32742,365897N1205221W001,985880,1963-12-20T00:00:00Z,441.76,441.76,NA,NA,NA,NA,NA,Can't get tape in casing,NA,NA,1,Department of Water Resources,NA,1,Department of Water Resources
32742,365897N1205221W001,985879,1962-03-27T00:00:00Z,441.76,441.76,NA,NA,NA,NA,NA,Pumping,NA,NA,1,Department of Water Resources,NA,1,Department of Water Resources
32742,365897N1205221W001,985878,1961-05-03T00:00:00Z,441.76,441.76,0,705.9,-264.14,705.9,705.9,NA,Unknown,Water level accuracy is unknown,1,Department of Water Resources,NA,5167,United States Geological Survey
