STN_ID,SITE_CODE,WLM_ID,MSMT_DATE,WLM_RPE,WLM_GSE,RDNG_WS,RDNG_RP,WSE,RPE_WSE,GSE_WSE,WLM_QA_DESC,WLM_DESC,WLM_ACC_DESC,WLM_ORG_ID,WLM_ORG_NAME,MSMT_CMT,COOP_AGENCY_ORG_ID,COOP_ORG_NAME
34362,364305N1198388W001,1059113,1969-03-13T00:00:00Z,228.77,227.77,NA,NA,NA,NA,NA,Can't get tape in casing,NA,NA,1,Department of Water Resources,NA,1,Department of Water Resources
34362,364305N1198388W001,1059112,1968-03-06T00:00:00Z,228.77,227.77,NA,NA,NA,NA,NA,Pumping,NA,NA,1,Department of Water Resources,NA,1,Department of Water Resources
34362,364305N1198388W001,1059111,1967-02-27T00:00:00Z,228.77,227.77,NA,NA,NA,NA,NA,Pumping,NA,NA,1,Department of Water Resources,NA,1,Department of Water Resources
34362,364305N1198388W001,1059110,1966-02-10T00:00:00Z,228.77,227.77,0,56.8,171.97,56.8,55.8,NA,Unknown,Water level accuracy is unknown,1,Department of Water Resources,NA,1,Department of Water Resources
34362,364305N1198388W001,1059109,1965-02-09T00:00:00Z,228.77,227.77,NA,NA,NA,NA,NA,Can't get tape in casing,NA,NA,1,Department of Water Resources,NA,1,Department of Water Resources
