STN_ID,SITE_CODE,WLM_ID,MSMT_DATE,WLM_RPE,WLM_GSE,RDNG_WS,RDNG_RP,WSE,RPE_WSE,GSE_WSE,WLM_QA_DESC,WLM_DESC,WLM_ACC_DESC,WLM_ORG_ID,WLM_ORG_NAME,MSMT_CMT,COOP_AGENCY_ORG_ID,COOP_ORG_NAME
34577,355800N1194918W001,708173,1961-10-10T00:00:00Z,276.47,276.47,NA,NA,NA,NA,NA,Special/Other,NA,NA,1,Department of Water Resources,NA,423,Kern County Water Agency
34577,355800N1194918W001,708172,1961-02-07T00:00:00Z,276.47,276.47,NA,NA,NA,NA,NA,Well has been destroyed,NA,NA,1,Department of Water Resources,NA,1106,JAMES IRRIGATION DISTRICT
34577,355800N1194918W001,708171,1960-10-05T00:00:00Z,276.47,276.47,NA,NA,NA,NA,NA,Unable to locate well,NA,NA,1,Department of Water Resources,NA,863,Buena Vista Water Storage District
34577,355800N1194918W001,708170,1960-02-09T00:00:00Z,276.47,276.47,0,86,190.47,86,86,NA,Unknown,Water level accuracy is unknown,1,Department of Water Resources,NA,1,Department of Water Resources
34577,355800N1194918W001,708169,1959-09-07T00:00:00Z,276.47,276.47,0,91,185.47,91,91,NA,Unknown,Water level accuracy is unknown,1,Department of Water Resources,NA,1,Department of Water Resources
