STN_ID,SITE_CODE,WLM_ID,MSMT_DATE,WLM_RPE,WLM_GSE,RDNG_WS,RDNG_RP,WSE,RPE_WSE,GSE_WSE,WLM_QA_DESC,WLM_DESC,WLM_ACC_DESC,WLM_ORG_ID,WLM_ORG_NAME,MSMT_CMT,COOP_AGENCY_ORG_ID,COOP_ORG_NAME
36962,357619N1194381W001,854157,1968-01-31T00:00:00Z,228.61,224.61,NA,NA,NA,NA,NA,Unable to locate well,NA,NA,1,Department of Water Resources,NA,423,Kern County Water Agency
36962,357619N1194381W001,854156,1962-03-16T00:00:00Z,228.61,224.61,NA,NA,NA,NA,NA,Special/Other,NA,NA,1,Department of Water Resources,NA,1,Department of Water Resources
36962,357619N1194381W001,854155,1961-03-09T00:00:00Z,228.61,224.61,NA,NA,NA,NA,NA,Can't get tape in casing,NA,NA,1,Department of Water Resources,NA,1,Department of Water Resources
36962,357619N1194381W001,854154,1960-10-11T00:00:00Z,228.61,224.61,0,73.2,155.41,73.2,69.2,NA,Unknown,Water level accuracy is unknown,1,Department of Water Resources,NA,1,Department of Water Resources
36962,357619N1194381W001,854153,1959-10-15T00:00:00Z,228.61,224.61,0,72,156.61,72,68,NA,Unknown,Water level accuracy is unknown,1,Department of Water Resources,NA,5167,United States Geological Survey
36962,357619N1194381W001,854152,1958-10-30T00:00:00Z,228.61,224.61,0,68.4,160.21,68.4,64.4,NA,Unknown,Water level accuracy is unknown,1,Department of Water Resources,NA,5167,United States Geological Survey
