STN_ID,SITE_CODE,WLM_ID,MSMT_DATE,WLM_RPE,WLM_GSE,RDNG_WS,RDNG_RP,WSE,RPE_WSE,GSE_WSE,WLM_QA_DESC,WLM_DESC,WLM_ACC_DESC,WLM_ORG_ID,WLM_ORG_NAME,MSMT_CMT,COOP_AGENCY_ORG_ID,COOP_ORG_NAME
51436,390278N1220102W001,2234962,2017-03-14T12:00:00Z,48.75,47,NA,NA,NA,NA,NA,Measurement Discontinued,NA,NA,1,Department of Water Resources,Tape Hangs up (monitoring 14N01W30Q002M in place of),1,Department of Water Resources
51436,390278N1220102W001,2214569,2016-10-11T12:00:00Z,48.75,47,NA,NA,NA,NA,NA,Pumping,NA,NA,1,Department of Water Resources,NA,1,Department of Water Resources
51436,390278N1220102W001,2204942,2016-08-01T12:00:00Z,48.75,47,14.9,108,-44.35,93.1,91.35,Casing leaking or wet,Steel tape measurement,Water level accuracy to nearest tenth of a foot,1,Department of Water Resources,"And OIL; Hangs up, hard to get repeatable measurement",1,Department of Water Resources
51436,390278N1220102W001,2198552,2016-06-06T12:00:00Z,48.75,47,13.7,100,-37.55,86.3,84.55,Oil or foreign substance in casing,Steel tape measurement,Water level accuracy to nearest tenth of a foot,1,Department of Water Resources,NA,1,Department of Water Resources
51436,390278N1220102W001,2192112,2016-03-14T09:00:00Z,48.75,47,13.3,45,17.05,31.7,29.95,Oil or foreign substance in casing,Steel tape measurement,Water level accuracy to nearest tenth of a foot,1,Department of Water Resources,NA,1,Department of Water Resources
